,org_sent,processed_sent
183, not a clean or especially safe location - lots of street rubbish and homeless people.,clean especially safe location lot street rubbish homeless people .
184,"Walking distance to Macy's, Empire State Building and Central Park.",walk distance macys empire state building central park .
185,The Italian Restaurant connected to the Hotel is great - great food and good service and not expensive.,italian restaurant connect hotel great great food good service expensive .
186,Service in hotel is minimal and no one will offer to help with bags etc.,service hotel minimal one offer help bag etc .
187,Great location.,great location .
188,Close to all transportation to get you anywhere you wanted to go in Manhattan.,close transportation get anywhere want go manhattan .
189,The rooms felt like you were stepping back in time in a good way giving a feeling that you were staying in a significant piece of history.,room feel like step back time good way give feeling stay significant piece history .
190,I thought it was rather expensive ,think rather expensive
191, NYC is an expensive city and the prices are comparable.,nyc expensive city price comparable .
192,We were given a complimentary upgrade to a room with 2 windows with an amazing view.,give complimentary upgrade room window amazing view .
193,Our friends were not so lucky and their view was of another room due to the architecture of the building.,friend lucky view another room due architecture building .
194, the food was hit and miss.,food hit miss .
195,Some staff went out of the way to make us feel welcome.,staff go way make feel welcome .
196,Didn’t really appreciate the daily resort fee as I did not use the fitness Center.,really appreciate daily resort fee use fitness center .
197,"All in all, I enjoyed my stay and I would stay there again.",enjoy stay would stay .
198,$25 for an electric kettle in the room is a rip off.,electric kettle room rip .
199,I chatted to housekeeping a couple times and she was a very kind and pleasant lady 🙂,chat housekeep couple time kind pleasant lady
200,The only reason I've been disappointed is that we have been charged $34 per night for the wife and phone calls.,reason disappoint charge per night wife phone call .
201,We were told that it was only a single fee of $34 for all the time we stayed at the hotel,tell single fee time stay hotel
202,I checked into the hotel late at night and went to sleep and woke up in the morning covered in bite marks from lice/bed bugs.,check hotel late night go sleep wake morning cover bite mark bug .
203,"After arguing with the hotel management they changed my room, refused to acknowledge the problem and instead tried to put the blame back onto me and said i brought the insects with me!",argue hotel management change room refuse acknowledge problem instead try put blame back onto say bring insect
204,The staff and the way the situation was handled was the worst customer service i've experienced in my life and im a frequent traveler and travel monthly all over the world.,staff way situation handle bad customer service experience life frequent traveler travel monthly world .
205,I spent my whole NYC trip uncomfortable and itchy and had to buy new clothes and lots of money at the pharmacy !,spend whole nyc trip uncomfortable itchy buy new clothe lot money pharmacy
206,"The room was relatively small, ",room relatively small
207, big enough for a couple.,big enough couple .
208,The art deco fittings in the bathroom and bedroom were beautiful.,art deco fitting bathroom bedroom beautiful .
209,"The location is fantastic with a 10 mins walk to Times Square and on the edge of Chelsea, Hells Kitchen and Hudson Yards.",location fantastic min walk time square edge chelsea hell kitchen hudson yard .
210, they were still replaced everyday.,still replace everyday .
211,"There was also no coffee maker in the room, so had to get up and go to Starbucks opposite everyday",also coffee maker room get go starbuck opposite everyday
212,"Excellent location, alright near by Penn Station and beautiful night view of empire state building.",excellent location alright near penn station beautiful night view empire state building .
213,Staff provided good assistance for early check in and understanding for an extended check out despite being fully booked.,staff provide good assistance early check understanding extended check despite fully book .
214,"Great position-good diner with great staff(Dora)- rooms a little small-I didn't notice water, coffee and tea were provided-helpful front desk, especially Michael the manager",great positiongood din great room little smalli notice water coffee tea providedhelpful front desk especially michael manager
215,The best thing is it’s location.,good thing location .
216,Very close to the main sights.,close main sight .
217,It had a small bath and an iron which was useful.,small bath iron useful .
218,Unfortunately there were no tea/coffee making facilities and no bottled water.,unfortunately make facility bottled water .
219,The hotel does need updating and redecoration.,hotel need updating redecoration .
220,We were on the 35th floor where the corridors were beginning to look shabby.,floor corridor begin look shabby .
221,We had some problems with our door keycard which needed replacing every day.,problem door keycard need replace every day .
222,"A nice receptionist - I can’t remember her name, sorry - recognised our frustration and gave us free breakfast vouchers for use in the Tick Tock Diner.",nice receptionist remember name sorry recognise frustration give free breakfast voucher use tick tock din .
223,"I would recommend a Mexican diner called Lucy’s just across from the hotel, which offered good food/ drink at a reasonable price especially during happy hour - 4 to 7 pm.",would recommend mexican diner call across hotel offer good drink reasonable price especially happy hour pm .
224, it's actually a full size,actually full size
225,Great location... small room and out dated bathroom for the price,great location small room dated bathroom price
226, needs to provide complimentary coffee and Tea services with coffee maker in the room,need provide complimentary coffee tea service coffee maker room
